{
  "artifacts": [
    {
      "bytes": 779479,
      "mimetype": "text/css",
      "name": "point_of_sale.assets_prod.min.css",
      "sha256": "703f31cca655e2e1fb33b49f3f2f2fbf6b981e503fdbbc218018b5c91ec23019",
      "url": "/insilos/assets/5116d98/retail-pos.prod-preload.min.css"
    },
    {
      "bytes": 3343706,
      "mimetype": "application/javascript",
      "name": "point_of_sale.assets_prod.min.js",
      "sha256": "564433e485968bfcf51708280ac90c94b8ea9e794a0c0ce8ba1382eb3bb6fd1d",
      "url": "/insilos/assets/8c356f4/retail-pos.prod-preload.min.js"
    }
  ],
  "bundle": "point_of_sale.assets_prod",
  "collected_at": "2026-08-23T04:52:28.609627+00:00",
  "database": "tmp_pos_react_acc0099d",
  "schema_version": 1
}
